{
  "schema_version": "0.1",
  "theme_id": "miriad-system-precision",
  "metadata": {
    "name": "Mirriad System Precision",
    "description": "Industrial-precision visual theme for an engineering electronics manufacturer with own SMT/SMD production: cool neutral canvas, deep technical primary, restrained accent, border-led surfaces and mono eyebrows, self-selected while brand desired_character was empty.",
    "interpreter_skill": "designer.theme.interpret",
    "interpreter_version": "0.1"
  },
  "colors": {
    "canvas": "#eef1f4",
    "surface": "#ffffff",
    "surface_muted": "#e3e8ed",
    "text": "#10161c",
    "text_muted": "#5b6672",
    "primary": "#14414f",
    "primary_hover": "#0f3140",
    "on_primary": "#ffffff",
    "accent": "#d4e3ea",
    "on_accent": "#0f2a33",
    "inverse": "#0c1218",
    "inverse_text": "#f4f7f9",
    "line": "#c4cdd6",
    "focus": "#1f7a9c",
    "accent_palette": ["#1f7a9c", "#9fb8c2"]
  },
  "typography": {
    "font_display": "\"Segoe UI\", \"Helvetica Neue\", Arial, sans-serif",
    "font_body": "\"Segoe UI\", Arial, sans-serif",
    "font_mono": "\"Cascadia Mono\", Consolas, ui-monospace, monospace",
    "display": {
      "size": {"min": "2.4rem", "preferred": "5.4vw", "max": "4.8rem"},
      "weight": 600,
      "line_height": 1.04,
      "tracking": "-0.025em"
    },
    "heading": {
      "size": {"min": "1.6rem", "preferred": "3.1vw", "max": "2.7rem"},
      "weight": 600,
      "line_height": 1.1,
      "tracking": "-0.015em"
    },
    "body": {
      "size": "1.05rem",
      "weight": 400,
      "line_height": 1.6,
      "tracking": "0"
    },
    "eyebrow": {
      "size": "0.72rem",
      "weight": 700,
      "line_height": 1.3,
      "tracking": "0.09em"
    }
  },
  "spacing": {
    "density": "balanced",
    "section": {"min": "3.5rem", "preferred": "7vw", "max": "7rem"},
    "content": {"min": "1.1rem", "preferred": "2.6vw", "max": "3rem"},
    "block_gap": "0.75rem"
  },
  "shape": {
    "card_radius": "10px",
    "panel_radius": "16px",
    "button_radius": "8px"
  },
  "effects": {
    "card_border": {
      "width": "1px",
      "color_role": "line"
    },
    "card_shadow": {
      "x": "0",
      "y": "8px",
      "blur": "24px",
      "spread": "-10px",
      "color": "#0c1218",
      "opacity": 0.16
    }
  },
  "decisions": [
    {
      "id": "visual-direction-from-business-context",
      "source_type": "INTERPRETER_DECISION",
      "decision": "Выбрано визуальное направление «industrial precision»: холодная нейтральная canvas, глубокий технический primary, сдержанный accent, низкие радиусы, border-led поверхности и mono-brow.",
      "evidence": [
        "SiteContext.brand.desired_character пуст — бренд не предписал визуальный характер",
        "semantic_identity.entity_type = инженерная компания с собственным производством электроники",
        "semantic_identity.categories включают контрактное производство электроники и SMT/SMD-монтаж печатных плат",
        "audience — российские инженерно-производственные компании с инженерной командой и повторным производством PCB"
      ],
      "reason": "Desired_character пуст, но grounded business context достаточен (business type, audience, positioning, offers, constraints), поэтому интерпретация не блокируется: направление выбрано интерпретатором и зафиксировано как INTERPRETER_DECISION."
    },
    {
      "id": "brand-inputs-absent-safe-fallbacks",
      "source_type": "FALLBACK",
      "decision": "Использованы безопасные системные font stacks и синтезированная палитра; реальных brand colors, fonts и reference не существовало.",
      "evidence": [
        "brand.existing_colors пуст",
        "brand.existing_fonts пуст",
        "brand.reference = null"
      ],
      "reason": "Отсутствие brand inputs не блокирует интерпретацию: применён безопасный универсальный вариант и зафиксирован как FALLBACK."
    },
    {
      "id": "single-primary-cta-color-role",
      "source_type": "CONTEXT_DERIVED",
      "decision": "primary — глубокий технический цвет для единственного CTA «Отправить проект на расчёт»; accent — светлый технический tint для accent surfaces.",
      "evidence": [
        "conversion.primary_cta.label = «Отправить проект на расчёт»",
        "conversion.secondary_ctas пуст"
      ],
      "reason": "Единственный primary CTA обосновывает экономное использование action-accent цвета и отдельный сдержанный accent surface color."
    },
    {
      "id": "border-led-flat-effects",
      "source_type": "INTERPRETER_DECISION",
      "decision": "card_border = 1px line; card_shadow — узкая мягкая тень с отрицательным spread. Поверхности border-led, а не shadow-led.",
      "evidence": [
        "positioning.differentiators включают проверку BOM и посадочных мест и DFM-review",
        "proof включает инженерную проверку производственной пригодности и собственную SMT-линию"
      ],
      "reason": "Техническая точность и инженерная проверяемость читаются через строгие borders и плоские поверхности, а не через декоративные тени."
    },
    {
      "id": "low-contrast-line-for-opaque-borders",
      "source_type": "INTERPRETER_DECISION",
      "decision": "line — светлый низкоконтрастный цвет, компенсирующий отсутствие alpha в v0.1 contract.",
      "evidence": [
        "ThemeSpec v0.1: colors.line принимает только #RRGGBB без alpha"
      ],
      "reason": "Contract запрещает alpha в базовых цветах, поэтому визуальная мягкость разделителей достигается выбором светлого оттенка, а не прозрачностью."
    },
    {
      "id": "mono-eyebrow-for-technical-markers",
      "source_type": "INTERPRETER_DECISION",
      "decision": "Eyebrow использует моноширинный font stack и широкий tracking как технический маркер секций.",
      "evidence": [
        "content.required_terms включают BOM, Gerber, Pick&Place, DFM, SMT/SMD",
        "semantic_identity.entity_type = инженерная компания с собственным производством электроники"
      ],
      "reason": "Моноширинный eyebrow поддерживает технический характер контента и разделяет смысловые секции без декоративного украшательства."
    },
    {
      "id": "low-radii-for-engineering-character",
      "source_type": "INTERPRETER_DECISION",
      "decision": "Низкие радиусы card/panel/button (10/16/8px) соответствуют инженерно-производственной идентичности.",
      "evidence": [
        "semantic_identity.categories включают контрактное производство электроники и SMT/SMD-монтаж",
        "audience — инженерно-производственные компании с технической экспертизой"
      ],
      "reason": "Низкие радиусы читаются как точность и сдержанность, согласуясь с B2B инженерной аудиторией и отсутствием emotional/consumer характера."
    }
  ]
}